{
  "artifact_policy": {
    "large_artifact_justification": "",
    "max_inline_bytes": 5000000
  },
  "claim_ceiling": "Necessary exact working-unit pair-entry lower bounds only; no exact optimum, source values, syllabary, language, native word boundary, historical use or meaning.",
  "commands": {
    "run": "python3 experiments/yolo/gdt1269_space_free_pair_table_capacity/src/run.py",
    "validate": "python3 experiments/yolo/gdt1269_space_free_pair_table_capacity/src/validate.py"
  },
  "created": "2026-10-07",
  "dependencies": [
    "GDT001",
    "GDT1235",
    "GDT1259",
    "GDT1263",
    "GDT1243"
  ],
  "experiment_id": "GDT1269",
  "inputs": [
    {
      "path": "experiments/yolo/gdt1259_paragraph_integer_balance/artifacts/CERTIFICATES.json",
      "role": "frozen source certificate or prior scope evidence",
      "sha256": "e2be0d12afbeb3efbb40f3a9a9ccc6ede89da99b586148991d1f20f2b26d836b"
    },
    {
      "path": "experiments/yolo/gdt1259_paragraph_integer_balance/src/SPEC.json",
      "role": "frozen source certificate or prior scope evidence",
      "sha256": "2d806468e19f1da3f6defe6ac908c1d6c83879841f207f2c99e8c4b19f85deb5"
    },
    {
      "path": "experiments/yolo/gdt1259_paragraph_integer_balance/artifacts/VALIDATION.json",
      "role": "frozen source certificate or prior scope evidence",
      "sha256": "94ae83c2e46e97c78e96f2206882b65b12f1d8168ceec86d41ce9eb6fc251415"
    },
    {
      "path": "gdt001_block_cipher_results.json",
      "role": "frozen source certificate or prior scope evidence",
      "sha256": "d78651556a4cb5ce0535ec0bead6cf5ff07edec356ca594b9d80bad7b3d3cf90"
    },
    {
      "path": "run_gdt001_block_cipher.py",
      "role": "frozen source certificate or prior scope evidence",
      "sha256": "3ac2de25ff6f51d72d5f0e29db42b053542bb47f1ee60c9655dbc9677bc12f5e"
    },
    {
      "path": "experiments/yolo/gdt1263_ordered_symbol_class_capacity/REPORT.md",
      "role": "frozen source certificate or prior scope evidence",
      "sha256": "f328bb69a13fb2d0bd3ff657d9b2c3cc3b6d05a54f1dbff53015ad77deb5551a"
    },
    {
      "path": "experiments/yolo/gdt1243_f45r_mandatory_grapheme_gaps/REPORT.md",
      "role": "frozen source certificate or prior scope evidence",
      "sha256": "1a289a3076b9d8b3653945451ddce1410c686dfe57821db123fe73ec1abaa015"
    }
  ],
  "outputs": [
    {
      "path": "experiments/yolo/gdt1269_space_free_pair_table_capacity/METHOD.md",
      "role": "reproducibility artifact",
      "sha256": "92c362062a950e0d62a77339009745b4f950db51d4e12ef5df3668cb989e0d49"
    },
    {
      "path": "experiments/yolo/gdt1269_space_free_pair_table_capacity/PREREGISTRATION.md",
      "role": "reproducibility artifact",
      "sha256": "92c362062a950e0d62a77339009745b4f950db51d4e12ef5df3668cb989e0d49"
    },
    {
      "path": "experiments/yolo/gdt1269_space_free_pair_table_capacity/README.md",
      "role": "reproducibility artifact",
      "sha256": "1d7375d8a47c52fbfd9e69b0f76d736fe7408bb1e8dee076e49bc6d28a9801a0"
    },
    {
      "path": "experiments/yolo/gdt1269_space_free_pair_table_capacity/REPORT.md",
      "role": "primary_report",
      "sha256": "515caa144e960321a4fde542365c2fafc7ae4d96805ef9bb8cf3e7434c55d8aa"
    },
    {
      "path": "experiments/yolo/gdt1269_space_free_pair_table_capacity/artifacts/CONTROLS.json",
      "role": "reproducibility artifact",
      "sha256": "02f595e7ee23b8eb049cbfe7da0983165b4da91a9c90ba368da9df2710f16331"
    },
    {
      "path": "experiments/yolo/gdt1269_space_free_pair_table_capacity/artifacts/IDEA_REVIEW.json",
      "role": "reproducibility artifact",
      "sha256": "92d11a72f1d4cb7b98f0be27256d18d4ce52f928f6150c15fe873d680a4a5158"
    },
    {
      "path": "experiments/yolo/gdt1269_space_free_pair_table_capacity/artifacts/PAIR_CERTIFICATES.json.gz",
      "role": "reproducibility artifact",
      "sha256": "6bff3f71698152415ff0e285f40d66fa521623f0d83a3a27c86146970d588463"
    },
    {
      "path": "experiments/yolo/gdt1269_space_free_pair_table_capacity/artifacts/PROOF_REVIEW.json",
      "role": "reproducibility artifact",
      "sha256": "cc394da8b8608deffaf10109e84b9eeb61cf3d49ca1e8f60f867d73a1e78b44b"
    },
    {
      "path": "experiments/yolo/gdt1269_space_free_pair_table_capacity/artifacts/README.md",
      "role": "reproducibility artifact",
      "sha256": "ae7d2d91af4d6362aeda38582b1790d3bf29b968555d177b21dfec9aaf2be83f"
    },
    {
      "path": "experiments/yolo/gdt1269_space_free_pair_table_capacity/artifacts/RESULT.json",
      "role": "reproducibility artifact",
      "sha256": "97748ed335871498e635cc96329c1bc90339284b2d7c4e9e56bc89ff37d80f62"
    },
    {
      "path": "experiments/yolo/gdt1269_space_free_pair_table_capacity/artifacts/RUN_RECEIPT.json",
      "role": "reproducibility artifact",
      "sha256": "8a23a181a8abba776c6f234cd5b0b6c1f78bf80bcd2bef6af670143fcd6a94d6"
    },
    {
      "path": "experiments/yolo/gdt1269_space_free_pair_table_capacity/artifacts/VALIDATION.json",
      "role": "reproducibility artifact",
      "sha256": "cd9db6db73ba4f788a4f516fad9a3581836838fc0f9505d9cf7bc7e6f677485c"
    },
    {
      "path": "experiments/yolo/gdt1269_space_free_pair_table_capacity/artifacts/VALIDATOR_CONTROLS.json",
      "role": "reproducibility artifact",
      "sha256": "fb6b75e63ec9400b10b538ceebf8617eae02087f1a098884f1c5272e0ac42c1c"
    },
    {
      "path": "experiments/yolo/gdt1269_space_free_pair_table_capacity/src/REGISTRATION_LOCK.json",
      "role": "reproducibility artifact",
      "sha256": "176516bed679dbedc09caced0e02c55d1d6d3131950c2e83acf160e1d6c67751"
    },
    {
      "path": "experiments/yolo/gdt1269_space_free_pair_table_capacity/src/run.py",
      "role": "reproducibility artifact",
      "sha256": "aa9ae593fab5ac68967591c7fadc6998f05cfffa55dcb057123788b9bb152e88"
    },
    {
      "path": "experiments/yolo/gdt1269_space_free_pair_table_capacity/src/validate.py",
      "role": "reproducibility artifact",
      "sha256": "6a7c2520d2bd393473fc1aab0b854cb473bdafd312d996bb9c83940d6e1bafe0"
    }
  ],
  "question": "Can at most32fixed two-unit entries plus optionally one singleton control cover the old continuous snippets when all visible spacing and initial phases are unknown?",
  "schema_version": 1,
  "sealed_data": {
    "f84": "FORBIDDEN",
    "f84r": "FORBIDDEN"
  },
  "slug": "space_free_pair_table_capacity",
  "status": "ALL_SMALL_PAIR_TABLES_EXCLUDED",
  "title": "Small pair-code tables without visible-space alignment",
  "updated": "2026-10-07",
  "validation": {
    "status": "PASS",
    "artifact": "experiments/yolo/gdt1269_space_free_pair_table_capacity/artifacts/VALIDATION.json"
  }
}
