{
  "artifact_policy": {
    "large_artifact_justification": "",
    "max_inline_bytes": 5000000
  },
  "claim_ceiling": "Exploratory C0 construction and exposed diagnostics only; no selected meanings, language, source identity, significance or independent confirmation.",
  "commands": {
    "run": "python3 experiments/yolo/gdt1163_correlative_relation_whole_account/src/run.py",
    "validate": "python3 experiments/yolo/gdt1163_correlative_relation_whole_account/src/validate.py"
  },
  "created": "2026-10-03",
  "dependencies": [
    "GDT608",
    "GDT787",
    "GDT882",
    "GDT1026",
    "GDT1137",
    "GDT1146",
    "GDT1147"
  ],
  "experiment_id": "GDT1163",
  "inputs": [
    {
      "path": "research_registry/proposals/production_origin_supply_20261003/CORE_PROPOSAL.json",
      "sha256": "3adc9461119c05eb738b5becc0a6d7abf909a56ca462bf0dfb5be7348ae31f90",
      "role": "fixed previously exposed source/core/profile/diagnostic input"
    },
    {
      "path": "research_registry/proposals/production_origin_supply_20261003/AUTHOR_CORRELATIVE_EXPLANATION_DECISION.md",
      "sha256": "8d7645de5bedf03c743d2faeea1ca3f5092f7271c7e56434a5d4eaad734d502f",
      "role": "fixed previously exposed source/core/profile/diagnostic input"
    },
    {
      "path": "experiments/yolo/gdt1137_material_process_type_return/artifacts/NATIVE_SOURCE.json",
      "sha256": "40fab9cdfced7433f9b250d811bdcc654b3e5c17370eeb43d156f9bc474d6b2d",
      "role": "fixed previously exposed source/core/profile/diagnostic input"
    },
    {
      "path": "experiments/yolo/gdt1137_material_process_type_return/artifacts/WORD_PRIORS.json",
      "sha256": "7f25081cdd2178d2c8fa2a38159ab83a39f5f8789f065f8503e7b19eb50813d8",
      "role": "fixed previously exposed source/core/profile/diagnostic input"
    },
    {
      "path": "research_registry/work_batches/ten_hours_20260915/LULL_TYPED_QUESTIONS_SOURCE_20260920.json",
      "sha256": "ea41dc1345dc04a7b0c7eadc1da4321403548a714b3ee1df3e181932b0f7aea9",
      "role": "fixed previously exposed source/core/profile/diagnostic input"
    },
    {
      "path": "experiments/yolo/gdt1146_frozen_qokedy_argument_transfer/artifacts/CASES.json",
      "sha256": "1a85bd14e5cce6bfbac7182943bc431fa3e17ef68030455a79d168229140bc47",
      "role": "fixed previously exposed source/core/profile/diagnostic input"
    }
  ],
  "outputs": [
    {
      "path": "experiments/yolo/gdt1163_correlative_relation_whole_account/AUTHOR_READING.md",
      "sha256": "bbe262eb2c97a0a26d9546ed463a35d4c42cd58cb23ffba1ab65b3bfa10444ad",
      "role": "reproducibility source, registration, frozen account or result"
    },
    {
      "path": "experiments/yolo/gdt1163_correlative_relation_whole_account/CANDIDATE_TABLE.md",
      "sha256": "920ce80c08b55fe67495e4442b3d9fbaaf0572e19974f5267e3b12fcb0cce2b4",
      "role": "reproducibility source, registration, frozen account or result"
    },
    {
      "path": "experiments/yolo/gdt1163_correlative_relation_whole_account/METHOD.md",
      "sha256": "aa513a651b70f3df41c09783a91ebad2acdecae0c4996c312960cfc4bf7045d4",
      "role": "reproducibility source, registration, frozen account or result"
    },
    {
      "path": "experiments/yolo/gdt1163_correlative_relation_whole_account/PREREGISTRATION.md",
      "sha256": "1901ebcc06f59e2f74c4ae388e5e96b32bb82e73420782bcc31ab709c4744c40",
      "role": "reproducibility source, registration, frozen account or result"
    },
    {
      "path": "experiments/yolo/gdt1163_correlative_relation_whole_account/README.md",
      "sha256": "328228de45b4990670c4d4be1af31758cb992f6e5055f43ab75a7129da7c6a2c",
      "role": "reproducibility source, registration, frozen account or result"
    },
    {
      "path": "experiments/yolo/gdt1163_correlative_relation_whole_account/REPORT.md",
      "sha256": "7631b437e880431f3fe7c0794165add1b5072c3f1321f57a0d349c9439c29fbd",
      "role": "report"
    },
    {
      "path": "experiments/yolo/gdt1163_correlative_relation_whole_account/VALIDATION_PLAN.md",
      "sha256": "b749753ad58f768159e34a1f24c6286d956f1add94dfcaed9dae0eccd4967e43",
      "role": "reproducibility source, registration, frozen account or result"
    },
    {
      "path": "experiments/yolo/gdt1163_correlative_relation_whole_account/artifacts/AUTHOR_ACCOUNT.json",
      "sha256": "50a2118cd2189b9942221147392c597960d0599cae4578823cf1eb3d0c6871b7",
      "role": "reproducibility source, registration, frozen account or result"
    },
    {
      "path": "experiments/yolo/gdt1163_correlative_relation_whole_account/artifacts/AUTHOR_LOCK.json",
      "sha256": "993147a54c2cde15d8c8c2ea05ff1103abe4e2d872c1c944f56b2ea6d2333208",
      "role": "reproducibility source, registration, frozen account or result"
    },
    {
      "path": "experiments/yolo/gdt1163_correlative_relation_whole_account/artifacts/AUTHOR_RECEIPT.json",
      "sha256": "60b9d3444adf7c9fccde404757cf1f674a603deed3a2b21e5ac10783f3d99d54",
      "role": "reproducibility source, registration, frozen account or result"
    },
    {
      "path": "experiments/yolo/gdt1163_correlative_relation_whole_account/artifacts/DIAGNOSTICS.json",
      "sha256": "26e1f9e86a3524f8c6e4da8a7e990f99a2316219b7bd6a1d92f29e02dbc93632",
      "role": "reproducibility source, registration, frozen account or result"
    },
    {
      "path": "experiments/yolo/gdt1163_correlative_relation_whole_account/artifacts/DIAGNOSTICS.tsv",
      "sha256": "65144a61f3eb650b44e24dc0d20b189e555b766a62aa2e5d509d1b71f12ea4f5",
      "role": "reproducibility source, registration, frozen account or result"
    },
    {
      "path": "experiments/yolo/gdt1163_correlative_relation_whole_account/artifacts/README.md",
      "sha256": "ae7d2d91af4d6362aeda38582b1790d3bf29b968555d177b21dfec9aaf2be83f",
      "role": "reproducibility source, registration, frozen account or result"
    },
    {
      "path": "experiments/yolo/gdt1163_correlative_relation_whole_account/artifacts/RESULT.json",
      "sha256": "f14cd1c91dbd688c193e0cc0852855a1682b4a13eaaf600f16f60cf07fcf6fb1",
      "role": "reproducibility source, registration, frozen account or result"
    },
    {
      "path": "experiments/yolo/gdt1163_correlative_relation_whole_account/artifacts/ROOT_CORE_ACK.json",
      "sha256": "fb9e4dff5f970091a72939f38b1322caf9e98e9f20a692b85b73edb7b2b19379",
      "role": "reproducibility source, registration, frozen account or result"
    },
    {
      "path": "experiments/yolo/gdt1163_correlative_relation_whole_account/artifacts/ROOT_PROBES.json",
      "sha256": "8a4a93362f4e63fb773d13332355b9c2ead01e7eccca61f4752bd5e8b4132313",
      "role": "reproducibility source, registration, frozen account or result"
    },
    {
      "path": "experiments/yolo/gdt1163_correlative_relation_whole_account/artifacts/SEMANTIC_REVIEW.md",
      "sha256": "19638e6eaced1b0d16ec941acb4ac919a1a1dfed445d0baa9bee4362c734d56b",
      "role": "reproducibility source, registration, frozen account or result"
    },
    {
      "path": "experiments/yolo/gdt1163_correlative_relation_whole_account/artifacts/SEMANTIC_REVIEW_PLAN.md",
      "sha256": "bf6b097fa3715e1f936ff36d9a45aa949a105d1ea03c518b6d2662c6907399b1",
      "role": "reproducibility source, registration, frozen account or result"
    },
    {
      "path": "experiments/yolo/gdt1163_correlative_relation_whole_account/artifacts/VALIDATION.json",
      "sha256": "ddced8bedbad9b16c07bb965f99fd630c19afb57621008ecb71b2de2f6a524b8",
      "role": "reproducibility source, registration, frozen account or result"
    },
    {
      "path": "experiments/yolo/gdt1163_correlative_relation_whole_account/artifacts/VALIDATION.md",
      "sha256": "1cc444c02c707e214fbe89fc48e15d4e344497bdc1d79940ac1dc540599e324a",
      "role": "reproducibility source, registration, frozen account or result"
    },
    {
      "path": "experiments/yolo/gdt1163_correlative_relation_whole_account/src/CORE_FREEZE.json",
      "sha256": "3adc9461119c05eb738b5becc0a6d7abf909a56ca462bf0dfb5be7348ae31f90",
      "role": "reproducibility source, registration, frozen account or result"
    },
    {
      "path": "experiments/yolo/gdt1163_correlative_relation_whole_account/src/author.py",
      "sha256": "68e1913fb4123f0b797d742763b39450e5fc18131620bb485a9f7cec264c7000",
      "role": "reproducibility source, registration, frozen account or result"
    },
    {
      "path": "experiments/yolo/gdt1163_correlative_relation_whole_account/src/probe_author.py",
      "sha256": "39312f3a3e351306308dd0433f7b18f33d9db8fb46dbf7cc4ec05b2d678ce6cb",
      "role": "reproducibility source, registration, frozen account or result"
    },
    {
      "path": "experiments/yolo/gdt1163_correlative_relation_whole_account/src/run.py",
      "sha256": "98badf3f3f104ecae0caa9d6c94408e9bc53f86436b6f14df9bb0d222eafff35",
      "role": "reproducibility source, registration, frozen account or result"
    },
    {
      "path": "experiments/yolo/gdt1163_correlative_relation_whole_account/src/validate.py",
      "sha256": "3263e2f472dd1f549b9db6e4af8f22396772c30c04a9cde41279b396e7c447ea",
      "role": "reproducibility source, registration, frozen account or result"
    }
  ],
  "question": "Can one finite whole IT32 account construct same-principle active/receptive relations and consume their actual ordered endpoint while retaining all35 old counterexample contexts?",
  "schema_version": 1,
  "sealed_data": {
    "f84": "FORBIDDEN",
    "f84r": "FORBIDDEN"
  },
  "slug": "correlative_relation_whole_account",
  "status": "PARTIAL_NO_COMPLETE_READING",
  "title": "Complete correlative relation account with retained polarity rival",
  "updated": "2026-10-03",
  "validation": {
    "status": "PASS",
    "artifact": "experiments/yolo/gdt1163_correlative_relation_whole_account/artifacts/VALIDATION.json"
  }
}
